Component,Failure,DefectivePart,PartsReplaced,Cost,DealerComment_English
DISPLAY,SHORT CIRCUIT,MONITOR,1,1055.22,INCIDENT RADIO CUT OFF WHILE DRIVING CAUSE RADIO SHORT CIRCUIT SOLUTION D-R MONITOR SCREEN U.D.T. STATION PREPARATION PCM MODULE DIAGNOSTIC EXCEPT STATION PREPARATION PCM MODULE PROGRAMMING FOLLOWING DIAGNOSTIC OR REPLACEMENT FAULT MEMORY READING AND DELETING EXCEPT STATION PREPARATION
DISPLAY,BREAK,MONITOR,3,1227.82,INCIDENT HICONNECT PROBLEM CAUSE MONITOR BREAKAGE DIAGRAM SOLUTION MONITOR REPLACEMENT + CHECK AND PROGRAMMING
DISPLAY,DEFECT,MONITOR,2,1125.69,"COMPLAIN Radio navigation malfunction CAUSE Internal radio fault CORRECTION Radio replacement, programming. Test after repair OK"
DISPLAY,DEFECTIVE CONTACTS,MONITOR,1,1044.246084,"COMPLAINT RADIO UPDATE FAILURE CPRZ INFORMATION ABOUT UNFINISHED RADIO UPDATE, INABILITY TO PERFORM UPDATE CORRECTION DIAGNOSTICS AND RADIO/DISPLAY REPLACEMENT"
DISPLAY,SHORT CIRCUIT,MONITOR,1,1179.46,"COMPLAINT CHECK MULTIMEDIA SCREEN FAILURE IT GETS TOO HOT AND TURNED OFF AND ON BY ITSELF G CAUSE DIAGNOSIS IS MADE ON NIS CONTROL UNITS, IT IS PROGRAMMED, MULTIMEDIA SCREEN FAILURE, ELECTRICAL INSTALLATION IN POOR CONDITION, IT IS REPLACED AND GUIDED PROCEDURE IS MADE 07F269-02-CAN LINE ABSENCE OF COMMUNICATION WITH THE NIS CONTROL UNIT - ERRONEOUS, INTERMITTENT OR INCORRECT DATA SOLUTION D-M MONITOR SCREEN STATION PREPARATION U.D.T. READING MEMORY FAULTS AND ERASING NIS DIAGNOSIS NIS SYSTEM PROGRAMMING REVIEW OF ELECTRICAL INSTALLATION AND MONITOR CONNECTIONS PERFORM STEPS GUIDED PROCEDURE 07F269-02-CAN LINE: LACK OF COMMUNICATION WITH THE NIS CONTROL UNIT - ERRONEOUS, INTERMITTENT OR INCORRECT DATA"
DISPLAY,SHORT CIRCUIT,MONITOR,2,1162.38,"complaint the radio cannot be turned on and it overheats even when the ignition is off part. Internal radio failure. fix Diagnostic operations, radio exchange, programming"
DISPLAY,DEFECTIVE CONTACTS,MONITOR,1,894.436996,Error Display and radio drop out and have to be restarted several times a day Reason Defective display/monitor Correction Fault memory read out with UDT Checking the cables and connectors Monitor changed Monitor the code E-time = checking of wires and plugs
DISPLAY,INTERFERENCE,MONITOR,0,14.4,"COMPLAINT RADIO FREQUENTLY FAILS CAUSE RADIO UPDATE CORRECTION DIAGNOSIS, CHECK OPERATION, WIRING, FUSES. RADIO UPDATE AND TESTING =< OK"
DISPLAY,LOW OUTPUT/EFFICIENCY,MONITOR,2,1132.22,INCIDENT CAR RADIO DOES NOT WORK CAUSE POOR PERFORMANCE SOLUTION PREPARATION STATION U.D.T. TEST MODULES AND CLEARING MEMORY FAULTS EXCEPT PREPARATION STATION DIAGNOSTIC CAR RADIO EXCEPT PREPARATION S TATION PROGRAMMING CAR RADIO FOLLOWING DIAGNOSIS OR REPLACEMENT D-R HI-CONNECT DATA MODULE D-R MONITOR SCREEN
DISPLAY,DEFECT,MONITOR,2,1155.55,"COMPLAINT niche not working CAUSE defective monitor CORRECTION check monitor, replace monitor + program + test"
DISPLAY,DEFECT,MONITOR,1,1073.88,COMPLAINT MONITOR KEEPS FAILING CAUSE MONITOR DEFECTIVE CORRECTION CHECK MONITOR + USE UDT + MEASURE WIRING + REPLACE MONITOR + CLEAR ERRORS
DISPLAY,DEFECT,MONITOR,2,1061.23,"COMPLAINT radio no longer works CAUSE defect CORRECTION check radio, disassemble, does not work, replace + program"
DISPLAY,DEFECT,MONITOR,0,15.4,INCIDENT HICONNECT BLOCKS AT TIMES CAUSE CAR RADIO UPGRADE SOLUTION PREPARATION STATIO EASY HICONNECT DIAGNOSIS HICONNECT SOFTWARE UPDATE READING AND CLEARING FAULT MEMORY
DISPLAY,DEFECT,MONITOR,2,1401.306306,"RECL Hi Connect keeps crashing, DAB+ reception very poor REASON Radio internally defective CORRECTION Radio A+E, replace, program 1 Coin"
DISPLAY,DEFECT,MONITOR,0,21.845638,COMPLAINT The headphone button on the steering wheel does not disconnect the call CPRZ Error in the NIS software CORRECTION NIS software update
DISPLAY,DEFECT,MONITOR,2,1034.07,COMPLAINT CHECK HI-CONNECT ALWAYS FAILS CAUSE DEFECTIVE MONITOR CORRECTION DIAGNOSIS; CHECK WIRING & FUSES; REPLACE DEFECTIVE HI-CONNECT; PROGRAMMING EXECUTE; AFTER CHECK; --> EVERYTHING IS OK
DISPLAY,CAVITATION,MONITOR,0,21.6,"COMPLAINT RADIO CHECK CAUSE RADIO UPDATE CORRECTION DIAGNOSIS, OPERATION CHECK, RADIO UPDATE AND TESTING => OK"
DISPLAY,SHORT CIRCUIT,MONITOR,1,1066.02,"COMPLAINT Check radio failure CAUSE CHECK FAULTS WITH UDT, REPLACE NIS DUE TO SHORT CIRCUIT, RADIO DOES NOT WORK AND DOES NOT COMMUNICATE WITH THE COMPUTER SOLUTION REPLACE NIS"
DISPLAY,DEFECT,MONITOR,2,1414.2,RECL RADIO SWITCHES OFF BY ITSELF AND BOOTS AGAIN REASON NIS-(HARDWARE) DEFECTIVE CORRECTION 2 X TEST DRIVE TO FINISH NIS-(HARDWARE) RENEWED AND THE LATEST MAP VERSION PROGRAMMED TO 1082.1
DISPLAY,DEFECTIVE CONTACTS,MONITOR,1,1002.84,"COMPLAINT monitor radio/gps failed, only black screen CAUSE monitor defective CORRECTION replacing and programming monitor"
DISPLAY,DEFECT,MONITOR,3,1192.724834,COMPLAINT The radio turns off and on while driving CPRZ No response to touching the screen or adjusting the volume - internal fault CORRECTION Replacement of the radio
DISPLAY,SHORT CIRCUIT,MONITOR,2,1169.88,"COMPLAINT COMPLAIN RADIO FAILURE CAUSE INTERNAL MONITOR FAILURE. PERFORM GUIDED STEPS ETIM U0162-87 AND CONSULT WITH TECHNICIANS THD106705115 DICTAMINATE CHANGE MONITOR SOLUTION PERFORM ETIM GUIDED STEPS, CHANGE MONITOR RADIO AND PROGRAM"
DISPLAY,NO WARNING,MONITOR,3,1191,INCIDENT CAR RADIO CUTTING OUT INTERMITTENTLY CAUSE MONITOR SCREEN INDICATION MISSING SOLUTION CONTACT EFFICIENCY CHECK ELECTRICAL INST. CONNECTION VISUAL CHECK ELECTRICAL INST. FUNC. CAR RADIO HARNESS CHECK D-R MONITOR SCREEN REMOTE PROGRAMMING
DISPLAY,LOW OUTPUT/EFFICIENCY,MONITOR,0,82,INCIDENT CAR RADIO TURNS OFF BY ITSELF CAUSE POOR CAR RADIO PERFORMANCE SOLUTION THD 106504459STATION PREPARATION U.D.T. MODULE TEST AND MEMORY CLEARING FAULTS EXCEPT STATION PREPARATION CAR RADIO DIAGNOSIS EXCEPT STATION PREPARATION CAR RADIO PROGRAMMING FOLLOWING DIAGNOSIS OR REPLACEMENT REMOTE PROGRAMMING
DISPLAY,DEFECT,MONITOR,0,21.845638,COMPLAINT The radio turns off and on automatically while driving CPRZ Error in the NIS radio software CORRECTION Update of the NIS radio
DISPLAY,MISFIRE,MONITOR,0,33.5,"COMPLAINT GPS SOMETIMES DOES NOT START CAUSE SOFTWARE CORRECTION READ OUT OF FAULTS AND CLEAR, CHECK, UPDATE OF SOFTWARE"
DISPLAY,DEFECT,MONITOR,1,1577.15,"RECL Radio keeps turning off by itself REASON ICT control unit defective CORRECTION Error memory read, evaluated and deleted, Voltage supply CAN bus, resistances measured, Display monitor a+e, replaced, two coins were needed because it did not work the first time"
HEAD UNIT,UPDATE ENGINE ECU MS6.3,MONITOR,0,14.237137,COMPLAINT NAVIGATION IS FREEZING CPRZ NO NAVIGATION UPDATE CORRECTION NAVIGATION UPDATE
HEAD UNIT,NO WARNING,MONITOR,3,1091.82,INCIDENT CAR RADIO DOES NOT CUT OFF CAUSE BAD HEAD UNIT INDICATION SOLUTION CTRL CONNECTION+ CTRL HARNESS REMOVAL AND REPLACEMENT HED UNIT PROGRAMMING CLEARING FAULT CODES
HEAD UNIT,DEFECT,MONITOR,1,1647.1,RECL Gray and streaky image of the rear view camera REASON NIS defective CORRECTION Inspection E system according to ticket / request NIS renewed
AERIAL SPLITTER,NOT ASSEMBLED,AERIAL (ACCESS.),1,32.39,RECL Radio no reception REASON Radio antenna missing CORRECTION Antenna installed
AERIAL SPLITTER,SHORT CIRCUIT,POWER BOOSTER,3,116.59,INCIDENT RADIO DOES NOT RECEIVE FM CAUSE AMPLIFIER SHORT CIRCUIT SOLUTION check the elements and replace the amplifier
AERIAL SPLITTER,DEFECTIVE CONTACTS,POWER BOOSTER,0,101.5,"COMPLAIN radio has no reception CAUSE DEFECTIVE CONTACTS CORRECTION diagnostics, electrical control installation, a defect in the antenna lead was detected, disassembly and repair, reassembly. function test"
AERIAL SPLITTER,INCORRECT ADJUSTMENT,MONITOR,0,75.12,"COMPLAINT while driving the gps drowns out the hands-free calling CAUSE software niche needs to be updated CORRECTION No known actions in srt so ECONOMY Look up documentation and check settings, create THD 105933712 and try to update the software. update fails up to 2x. look up e-tim and execute KA 4903. Software has been updated"
AERIAL SPLITTER,DEFECT,AERIAL (ACCESS.),3,1237.6,RECL RADIO ERROR/NIS ERROR/DAB RECEPTION DISTURBED. DIAGNOSIS OF NIS/RADIO SYSTEM. ELECTRICAL SYSTEM CHECKED AND MEASURED REASON DEFECTIVE CORRECTION RADIO ANTENNA WITH AMPLIFIER RENEWED. ALSO INSTRUMENT PANEL AND HEADLINING A+E
B/TOOTH GPS/GSM AERIAL,SHORT CIRCUIT,KIT VIDEO,1,308.74,"COMPLAINT THE REAR HEADLIGHT CAMERA DOES NOT WORK CAUSE SHORT CIRCUIT IN THE REAR HEADLIGHT CAMERA CONTROL UNIT SOLUTION CHANGE REAR HEADLIGHT CAMERA KIT,"
B/TOOTH GPS/GSM AERIAL,SHORT CIRCUIT,KIT,1,399.475,COMPLAINT Check sat nav inop CAUSE internal material failure of sd card CORRECTION replaced sd card
B/TOOTH GPS/GSM AERIAL,SHORT CIRCUIT,KIT,1,399.475,COMPLAINT Check navigation not working CAUSE navigation was not reading valid sd card CORRECTION Replaced sd card and navigation working
B/TOOTH GPS/GSM AERIAL,DEFECT,KIT,1,386.975,"COMPLAINT CUSTOMER COMPLAINT SAT NAV NOT WORKING CAUSE INSPECTED SAT NAV NOT WORKING CHECKED CONNECTIONS - ALL GOOD TRIED ANOTHER SAT NAV SD CARD, WORKING FINE FAULTY SD CARD CORRECTION REMOVE AND REPLACE SAT NAV SD CARD"
B/TOOTH GPS/GSM AERIAL,DEFECT,KIT,1,409.58125,"COMPLAINT GPS ISSUE - PREVIOUS DEALER SAID SD CARD NOT WORKING. CAUSE CONFIRMED SAT NAV IN OPERATIVE. CORRECTION SWAPPED IN SD CARD FROM KNOWN GOOD VEHICLE, SAT NAV WORKING CORRECTLY WITH DONOR CARD. VEHICLE REQUIRES SD CARD REPLACEMENT, ORDERED NEW CARD AND SUPPLIED TO CUSTOMER, OK."
B/TOOTH GPS/GSM AERIAL,DEFECT,AERIAL (ACCESS.),1,514.66,"RECL Navigation freezes from time to time and shows incorrect positions REASON GPS antenna faulty CORRECTION Navigation system checked. Jawlannect and SD card updated, no improvement. Wiring completely checked. Diagnosis GPS antenna faulty. GPS antenna replaced and function test carried out."
B/TOOTH GPS/GSM AERIAL,DEFECTIVE CONTACTS,AERIAL (ACCESS.),2,560.43,DAMAGE TYPE NAVIGATOR DOES NOT WORK CAUSE DEFECTIVE GPS ANTENNA AND SD-CARD CORRECTION REPLACE ANTENNA AND SD CARD
B/TOOTH GPS/GSM AERIAL,DEFECT,ECU RADIONAVIGATOR,2,2471.9625,COMPLAINT SAT NAV INOPERATIVE CAUSE INTERNAL DEFECT IN SAT NAV UNIT CORRECTION CONNECTED EASY AND CHECKED FOR CODES. CONFIRMED SAT NAV UNIT DEFECTIVE AND NOT WORKING. REMOVED AND REPLACED SAT NAV UNIT AND PROGRAMMED.-EXTRA LABOUR = 3 COINS @ $94.00 PROOF OF COI USAGE ATTACHED.
B/TOOTH GPS/GSM AERIAL,SHORT CIRCUIT,ECU RADIONAVIGATOR,1,1996.3625,"COMPLAINT GPS WORKING INTERMITTENTLY CAUSE RECEIVER UNIT NOT READING GPS CORRECTION THD # 105987742 RECEIVER UNIT NOT READING GPS DIAGNOSE WITH THD FAULTY RECEIVER, BY INSERTING A SD CARD FROM ANOTHER VEHICLE AND FOUND UNIT STILL NOT PICKING UP GPS ORDER NEW UNIT. REMOVE AND REPLACE UNIT, CARRY OUT PROGRAMMING. FOUND SD CARD NOT READING IN NEW RECEIVER, PERFORM SOFTWARE UPDATE AS ADVISED BY THD. TEST OPERATION, OK."
B/TOOTH GPS/GSM AERIAL,SHORT CIRCUIT,ECU RADIONAVIGATOR,1,1912.99375,COMPLAINT CHECK ON RADIO TURNING ITSELF OFFF AND SAT NAV NOT WORKING CAUSE FOUND INTERNAL ELECTRICAL FAILURE WITH RADIO INFORMATIVE ECU NOT READING SD CARD. CORRECTION REMOVED AND REPLACED RADIO CARRIED OUT PROGRAMMING 2 COINS AND TESTED OPERATION OF MAPS. COIN CHARGE 2X106
B/TOOTH GPS/GSM AERIAL,WATER INFILTRATION,SUPPORT,2,225.21,"RECL The radio has no DAB reception. REASON Due to water entering the antenna base, the DAB amplifier is heavily oxidized and defective. CORRECTION The roof lining of the driver's cab was removed and installed. The DAB amplifier and the antenna were checked. The DAB amplifier was replaced with the antenna base."
B/TOOTH GPS/GSM AERIAL,CRACKED,SUPPORT,1,126.16,RECL ANTENNA ON THE ROOF IS LOOSE REASON ANTENNA BASE BROKEN CORRECTION ANTENNA BASE RENEWED - ALSO ROOF LINING INSIDE A&E
B/TOOTH GPS/GSM AERIAL,NOT ASSEMBLED,SUPPORT,0,136.64,"RECL OBU ANTENNA NOT INSTALLATED, IS IN THE ACCESSORY BOX REASON MISSING ASSEMBLY CORRECTION OBU ANTENNA INSTALLATED"
B/TOOTH GPS/GSM AERIAL,WATER INFILTRATION,SUPPORT,2.3,266.11,COMPLAINT RADIO AND GPS RESPOND SLOWLY - SOMETIMES AT ALL NOT CAUSE SEARCH WORK - WATER INFILTRATION VIA THE ANTENNA BASE CORRECTION DISASSEMBLY AND ASSEMBLING OF INTERNAL COVERING REPLACE ANTENNA BASE WATER DAMAGE TO ANTENNA PCB = CONSEQUENTIAL DAMAGE REPLACE POWER BOOSTER ANTENNA CLEANING COVERING -SMALLMAT1 = SEALING KIT -ECONOMY = SEARCH WORK+SEALING+CLEANING
B/TOOTH GPS/GSM AERIAL,DEFECTIVE CONTACTS,AERIAL (ACCESS.),2,52.88,RECALL Poor or no radio reception REASON Antenna base broken CORRECTION Replace antenna.
B/TOOTH GPS/GSM AERIAL,DEFECT,POWER BOOSTER,1,149.252252,"RECL Radio reception weak, interrupted REASON Amplifier oxidized, no contact (photo) CORRECTION Amplifier a+e, replace"
B/TOOTH GPS/GSM AERIAL,SHORT CIRCUIT,POWER BOOSTER,1,103.08311,COMPLAIN Radio cannot find DAB channels. CAUSE Antenna amplifier is shorted CORRECTION Antenna amplifier replaced
B/TOOTH GPS/GSM AERIAL,DEFECTIVE CONTACTS,POWER BOOSTER,1,197.32,RECL DAB reception not working REASON Antenna for DAB defective CORRECTION Antenna for DAB replaced
B/TOOTH GPS/GSM AERIAL,SHORT CIRCUIT,POWER BOOSTER,3,132.16,"COMPLAIN The radio signal is missing CAUSE Internal short circuit of the antenna amplifier, d+m part of the ceiling CORRECTION replacement of the amplifier"
B/TOOTH GPS/GSM AERIAL,DEFECTIVE CONTACTS,POWER BOOSTER,0,159.6,RECL NAVIGATION NOT FUNCTIONAL - NO GPS RECEPTION. ELECTRICAL SYSTEM CHECKED REASON DAMAGED PLUG CONTACT CORRECTION PLUG PINS ADJUSTED/INSTALLED ON GPS ANTENNA
B/TOOTH GPS/GSM AERIAL,DEFECT,POWER BOOSTER,5,333.82,"RECL DAB radio poor reception, interference and noise!!! REASON DAB antenna replaced CORRECTION Radio reception checked, DAB antenna replaced, vehicle roof dismantled, error memory read and deleted"
B/TOOTH GPS/GSM AERIAL,NOT ASSEMBLED,WIRE/CABLE,0,292.8,RECL GSM AND GPS ANTENNA FOR TOLL PRE-FITTING NOT CONNECTED REASON MISSING ASSEMBLY CORRECTION ANTENNA SET INSTALLED FUNCTIONAL TEST
B/TOOTH GPS/GSM AERIAL,LOW OUTPUT/EFFICIENCY,AERIAL (ACCESS.),1,131.7,"RECL RADIO JUST MAKES A LOT OF NOISE REASON ANTENNA RECEPTION TOO WEAK CORRECTION TROUBLESHOOTING ELECTRICAL SYSTEM. WINDOW ANTENNA A+E, REPLACED."
B/TOOTH GPS/GSM AERIAL,INCORRECT ASSEMBLY,MONITOR,0,57.2625,COMPLAINT Attend to radio needs programming. CAUSE Not programmed for Australia CORRECTION Connected computer Updated radio code to Australia. Updated maps for Australia Checked system & found ok.
B/TOOTH GPS/GSM AERIAL,DEFECTIVE CONTACTS,AERIAL (ACCESS.),0,111.6,"RECL Navi fails temporarily REASON Antenna faulty contact CORRECTION Navi checked, error memory read, antenna a-e, NIS then updated"
B/TOOTH GPS/GSM AERIAL,DEFECT,AERIAL (ACCESS.),1,277.89,"COMPLAINT navigation starts up very slowly / keeps searching CAUSE see thd 106405089 / replace antenna CORRECTION replace antenna / test operation of old antenna - without antenna - place new antenna When the device is searching and you disconnect the antenna for a moment, it immediately has a connection!!! Customer will try it in a moment"
B/TOOTH GPS/GSM AERIAL,DEFECT,AERIAL (ACCESS.),1,91.28,"COMPLAINT satellite functions fail CAUSE antenna defect CORRECTION diagnosis and check operation, replace antenna"
B/TOOTH GPS/GSM AERIAL,BREAK,AERIAL (ACCESS.),1,75.62,DAMAGE TYPE DAB SIGNAL ON CAR RADIO DOES NOT WORK CAUSE ANTENNA BREAKAGE CORRECTION ANTENNA REPLACEMENT SEE WIT 106283298
B/TOOTH GPS/GSM AERIAL,ADJUSTMENT,DUMMY MATERIAL FOR CAUSAL PART,0,32.5,"COMPLAINT Inspect vehicle for SAT NAV not working CAUSE Reset SAT NAV on Radio CORRECTION Connected vehicle checked for updates all updated, reset the Radio - checked GPS operation okay."
B/TOOTH GPS/GSM AERIAL,SHORT CIRCUIT,DUMMY MATERIAL FOR CAUSAL PART,0,239.625,"COMPLAINT GPS NOT WORKING CAUSE INTERNAL FAULT CORRECTION CHECK ALL CONNECTORS, RESET VDO, UPDATED COUNTRY CODE, REPROGRAMMED WITH ASSISTANCE FROM THD #105987742 ONCE REPROGRAMMING CARRIED OUT, TESTED OPERATION, OK. 14WU FOR TESTS CARRIED OUT SWAPPING OUT SD CARDS AND LIASIN WITH THD"
DAB RADIO BLUETOOTH,DEFECTIVE CONTACTS,FUSE,1,11.85,RECL Radio o.F. REASON Fuse defective CORRECTION Replace fuse.
DAB RADIO BLUETOOTH,DEFECTIVE CONTACTS,FUSE,0,185.28,"RECL RADIO CAN NO LONGER BE SWITCHED ON REASON 20A FUSE FOR THE RADIO DEFECTIVE / NO CAUSE FOR THE DEFECTIVE FUSE FOUND (NO SHORT CIRCUIT, ETC.) CORRECTION RADIO A+E / POWER SUPPLY CHECKED (CONNECTION TERM. 30 DE-ENERGIZED) / 20A FUSE REPLACED / TEST DRIVE CARRIED OUT OK."
DAB RADIO BLUETOOTH,BREAK,RADIO ACCESSORIES,2,106.8,INCIDENT CAR RADIO DOES NOT WORK ANYMORE. CAUSE AFTER CHECKING THE FUSES AND POWER SUPPLIES (ECONOMY TIME). CAR RADIO HS. SOLUTION CAR RADIO REPLACEMENT.
DAB RADIO BLUETOOTH,DEFECT,RADIO ACCESSORIES,1,65.490835,COMPLAINT THE RADIO DOESN'T WORK CAUSES RADIO DOES NOT START. RADIO DEFECT CORRECTION REPLACEMENT OF PARTS UNDER WARRANTY
DAB RADIO BLUETOOTH,DEFECT,RADIO ACCESSORIES,1,65.498982,COMPLAINT THE RADIO DOES NOT START CAUSES RADIO DEFECTIVE CORRECTION REPLACEMENT OF RADIO CASSETTE
DAB RADIO BLUETOOTH,DEFECTIVE CONTACTS,RADIO ACCESSORIES,1,164.69,RECL DETERMINE AND CORRECT RADIO ERROR REASON RADIO NOT FUNCTIONING CORRECTION CHECK WIRING RADIO REPLACED
DAB RADIO BLUETOOTH,DEFECT,RADIO ACCESSORIES,1,65.482689,COMPLAINT RADIO DOESN'T WORK CAUSES RADIO CASSETTE DEFECTIVE CORRECTION REPLACEMENT OF RADIO CASSETTE
DAB RADIO BLUETOOTH,SHORT CIRCUIT,RADIO ACCESSORIES,1,142.33,COMPLAINT RADIO NOT WORKING - RADION SHORT CIRCUIT CAUSE RADIO NOT WORKING - RADION SHORT CIRCUIT CORRECTION REPLACE RADIO
DAB RADIO BLUETOOTH,DEFECT,RADIO ACCESSORIES,1,65.498982,COMPLAINT THE CASSETTE RECORDER DOES NOT WORK CAUSES DEFECTIVE CASSETTE RECORDER CORRECTION REPLACED CASSETTE RECORDER
DAB RADIO BLUETOOTH,SHORT CIRCUIT,RADIO ACCESSORIES,1,118.73,COMPLAINT RADIO NOT WORKING - RADIO SHORT CIRCUIT CAUSE RADIO NOT WORKING - RADIO SHORT CIRCUIT CORRECTION REPLACE RADIO
DAB RADIO BLUETOOTH,DEFECT,RADIO ACCESSORIES,1,67.694501,COMPLAINT THE RADIO DOESN'T TURN ON CAUSES RADIO FAULT CORRECTION RADIO REPLACEMENT
DAB RADIO BLUETOOTH,DEFECT,RADIO ACCESSORIES,1,65.494909,COMPLAINT RADIO DOESN'T WORK CAUSES RADIO BLUETOOTH DEFECTIVE CORRECTION BLUETOOTH RADIO REPLACEMENT
DAB RADIO BLUETOOTH,SEIZURE,RADIO ACCESSORIES,0,39.3,"COMPLAINT radio blocked CAUSE update needed CORRECTION check radio, perform update"
DAB RADIO BLUETOOTH,BLOCKAGE,RADIO ACCESSORIES,0,78.6,"COMPLAINT radio stuck CAUSE update needed CORRECTION check radio, perform update radio + test (work via economy, no times in SRT)"
DAB RADIO BLUETOOTH,DEFECT,RADIO ACCESSORIES,1,1160.82,"COMPLAIN Radio does not work in freezing temperatures. No sound and the picture disappears. Works for a while again after reboot. CAUSE Probably a fault with the radio. CORRECTION Radio disassembly, check cabling and connectors, no visible faults. Tried changing the radio, don't know if it's ok until it gets cold again."
DAB RADIO BLUETOOTH,DEFECT,RADIO ACCESSORIES,1,753.471851,"Error Defective buttons on multimedia system Cause Defective ribbon print for the buttons Correction Replaced complete radio, as cable for buttons cannot be loosened"
DAB RADIO BLUETOOTH,DEFECT,RADIO ACCESSORIES,1,1086.25,"DAMAGE TYPE Navigator keys do not light up - Internal navigator error on key illumination - Check navigator operation, check electrical system, replace car radio CAUSE Internal navigator error on key illumination CORRECTION Check navigator operation, check electrical system, replace car radio"
DAB RADIO BLUETOOTH,SHORT CIRCUIT,RADIO ACCESSORIES,1,1254.95,"RECL Micro Phone in the radio is not working. Check and repair. REASON Microphone not working CORRECTION Radio hands-free system checked, different cell phones paired, plug and wiring visually checked, radio installed and replaced."
DAB RADIO BLUETOOTH,BREAK,RADIO TO REMANUFACT.,0,142.5,INCIDENT CAR RADIO TURNS OFF BY ITSELF AT TIMES CAUSE ELECTRICAL CHECK SOLUTION HARNESS REPAIR
DAB RADIO BLUETOOTH,SHORT CIRCUIT,ECU RADIONAVIGATOR,1,2052.3,"COMPLAINT MULTI MEDIA UNIT CONSTANTLY RESETTING, PLYING UP IN REVERSE , SCREEN NOT COMING UP IN REVERSE OCCASSIONAY AND MULTI MEDIA STAYING ON 2 HOURS AFTER TURNED OFF CAUSE INTERNAL SHORT IN RADIO CORRECTION CHECK AND TESTED MULTI MEDIA, SET TO INTERMEDIATE TURN OFF WITH KEY, STAYS OFF FOR 3 SECONDS THEN TURNS ON BY ITSELF.CHECKED AND TESTED BODY COMPUTER INPUTS AND OUTPUTS, TESTED WIRING FROM BODY MODULE TO RADIO, ALL OK,RESET RADIO STILL TURNING ON BY ITSELF, INTERNAL SHORT IN RADIO, SUPPLIED AND FITTED NEW RADIO ,TESTED ALL OK EXTRA LABOUR CHECK MUTLI MEDIA UNIT 1 WU CHECK AND TEST BODY MODULE 3 WU CHECK WIRING AND CONNECTIONS 10 WU RESET RADIO AND RETEST 2WU"
DAB RADIO BLUETOOTH,SHORT CIRCUIT,ECU RADIONAVIGATOR,1,1942.4875,COMPLAINT CUSTOMER SAW SMOKE COMING FROM CD PLAYER INSPECT AND DIAGNOSE CAUSE INTERNAL SHORT CIRCUIT CORRECTION INSPECT AS PER CUSTOMER. FOUND FUSE BLOWN CAUSING SMOKE TO COME OUT FROM THE UNIT INSPECTED WIRING. SUSPECT INTERNAL SHORT CIRCUIT ON CD PLAYER. REMOVE AND REPLACE CD PLAYER AND CONFIGURATE TO VEHICLE. CHARGED 30MINS FOR INSPECTING AND FINDING THE FAULT.
DAB RADIO BLUETOOTH,LOW OUTPUT/EFFICIENCY,ECU RADIONAVIGATOR,0,9.4,DAMAGE TYPE NAVIGATOR DOES NOT WORK - ASIST N¢ 105316749 CAUSE NAVIGATOR HOOKS UP THE PHONE BUT DOES NOT TAKE THE HANDS-FREE CALL CORRECTION REPLACEMENT OF NAVIGATOR GROUP SUPPLIED BY MAGNETI MARELLI - ASIST N¢ 105316749
DAB RADIO BLUETOOTH,DEFECT,ECU RADIONAVIGATOR,1,2012.4875,COMPLAINT RADIO TURNING OFF CONSTANTLY WHILE DRIVING CAUSE DEFECTIVE UNIT CORRECTION CONNECTED EASY AND CHECKED FOR FAULTS / CODES. INSPECTED OPERATION AND CONFIRMED UNIT TURNING OFF. ATTEMPTED TO UPDATE WITH FIELS FROM IWD AND FAILED TO UPDATE. REMOVED MODULE AND REPLACED WITH NEW. PROGRAMMED VIA TELESERVCES AND UPDATED VIA IWD. -EXTRA LABOUR = FAILED UPDATE PER ATTACHED THS AND FAULT FINDING 10WU. THD ATTACHED
DAB RADIO BLUETOOTH,SHORT CIRCUIT,INDICATOR,1,122.35,RECL USB/AUX plug from radio not working REASON USB/AUX socket is defective and does not work CORRECTION USB/AUX socket replaced
DAB RADIO BLUETOOTH,DEFECT,RADIO,1,631.18,DAMAGETYPE Defective car radio CAUSE The on/off button does not always work CORRECTION Car radio replacement
DAB RADIO BLUETOOTH,SHORT CIRCUIT,RADIO,1,539.876958,COMPLAINT RADIO TURNS OFF AUTOMATICALLY WHILE DRIVING CPRZ INTERNAL ELECTRICAL DAMAGE TO RADIO CORRECTION RADIO REPLACEMENT
DAB RADIO BLUETOOTH,DEFECT,RADIO,1,934.738739,RECL Radio partially not working Bluetooth for mobile phone connection does not work REASON Radio defective CORRECTION Make diagnosis Radio replaced Functional check carried out
DAB RADIO BLUETOOTH,LOW OUTPUT/EFFICIENCY,POWER BOOSTER,1,140.48,RECL DAB HAS NO RECEPTION SINCE NEW ANTENNA REASON WATER INTAKE ON AMPLIFIER CORRECTION AMPLIFIER RENEWED
DAB RADIO BLUETOOTH,DEFECT,MONITOR,2,865.96,COMPLAINT radio touch screen not working CAUSE radio defect CORRECTION new radio fitted and programmed
DAB RADIO BLUETOOTH,LOW OUTPUT/EFFICIENCY,MONITOR,2,1203.21,"Goals Customer says there is no image in the display for the radio Reason Stereo does not work Reading error codes Can't get in touch with NiS Check fuses -OK KCheck canbus -OK Control connector behind stereo, has plus and minus Stereo unit defective Reason: Internal error in device Change Installed new stereo unit Encoded new stereo, 1st coins Final test: Test of stereo - OK"
DAB RADIO BLUETOOTH,NO WARNING,MONITOR,0,77,RECL RADIO INTERMITTENTLY STOPS REASON Faulty operating software CORRECTION Software update performed
DAB RADIO BLUETOOTH,DEFECT,MONITOR,2,865.96,COMPLAINT navigation keeps dropping out CAUSE niche is defective CORRECTION niche replaced and programmed.
DAB RADIO BLUETOOTH,ADJUSTMENT,MONITOR,0,12.94,COMPLAINT radio starts playing by itself CAUSE software needs to be updated CORRECTION update radio software
DAB RADIO BLUETOOTH,SHORT CIRCUIT,RADIO,2,751.946309,"COMPLAINT The radio periodically jams and locks up - it cannot be turned off CAUSE Internal device fault, short circuit. CORRECTION Replacement of DAB radio."
DAB RADIO BLUETOOTH,DEFECT,RADIO,0,18.389261,"COMPLAINT RADIO DOES NOT WORK, VOICE COMMANDS DO NOT WORK CPRZ OUTDATED SOFTWARE VERSION CORRECTION DIAGNOSTICS, RADIO RESET AND SOFTWARE UPDATE"
DAB RADIO BLUETOOTH,SHORT CIRCUIT,RADIO,2,701.903802,"COMPLAINT Radio does not work. CPRZ Internal device fault, short to ground. CORRECTION Replacement of DAB radio, checklist not resolved, reported to THD 106003117."
DAB RADIO BLUETOOTH,DEFECT,RADIO,2,764.221477,"COMPLAINT Radio does not work. CPRZ Internal device fault, broken power supply circuit. CORRECTION Replacement of radio, repair of frayed insulation on the wiring harness powering the radio."
DAB RADIO BLUETOOTH,SHORT CIRCUIT,RADIO,3,690.474273,"COMPLAINT The radio turns off, freezes, cyclically refuses to turn on CPRZ Internal fault, short circuit in the device which causes overheating and shutdown of the device. CORRECTION Replacement of DAB radio."
DAB RADIO BLUETOOTH,SHORT CIRCUIT,RADIO,3,690.474273,"COMPLAINT The radio freezes, heats up, you can't switch anything for approx. 30 minutes. CPRZ Internal fault, short circuit in the device. CORRECTION Replacement of DAB radio."
DAB RADIO BLUETOOTH,SHORT CIRCUIT,RADIO,1,790.6,COMPLAIN THE RADIO SHUTS OFF ALL THE TIME CAUSE INTERNAL SHORT CIRCUIT IN RADIO CORRECTION TROUBLESHOOTING RADIO DIES ALL THE TIME INTERNAL SHORT CIRCUIT CHANGE RADIO DONE BASIC SETTINGS CHECK WORK DONE - OK
DAB RADIO BLUETOOTH,DEFECT,RADIO,1,672.785236,"COMPLAINT Radio - overheating message, display problems CPRZ The DAB radio's liquid crystal display has been damaged CORRECTION Replacement of the DAB radio receiver"
DAB RADIO BLUETOOTH,SHORT CIRCUIT,RADIO,1,674.657719,"COMPLAINT The radio display goes out from time to time (it turns orange and you can't see anything) CPRZ Internal fault in the device, broken internal circuit. CORRECTION Replacement of DAB radio."
DAB RADIO BLUETOOTH,DEFECT,RADIO,0,37.248322,COMPLAINT Radio freezes - does not respond to changes CPRZ Outdated DAB radio software CORRECTION Update DAB radio software
